"advert_name","advert_details","advert_price"
"14.1hh Pony Club Pony","ConnemaraGreyMare14 years14.1 hands","£3,500"
"CHACCO BLUE STALLION","","£550 *JULY OFFER*"
"BSJA Prospect","Welsh Section BBayMare9 years12.1 hands","£6,000"
"Lockinge Wilson","ConnemaraDapple grey6 years14.1 hands","£6,000 including full wardrobe"
"Top Class 143cm SHP","Riding PonyBayMare8 years143 cm (LHC)","£6,500 oiro"
"HOYS M&M LARGE JUNIOR RIDDEN","Welsh Section DBayMare7 years147 cm (AHC)","£15,000 ono"
"Pony club allrounder","AppaloosaGelding12 years13.2 hands","£3,950"
"stunning connemara mare","ConnemaraFleabitten greyMare12 years14.1 hands","£4,250 ono"
"Eye-catching and much-loved 13.1hh second competition pony","Welsh Part BredDunMare15 years13.1 hands","SOLD! Have fun!"
"TOP CLASS FIRST RIDDEN / LEAD REIN","Riding PonyChestnutFilly3 years12 hands","POA"
"British Riding pony 10 years old (138cm LHC) Gelding (PBA)","Riding PonyDark brownGelding10 years13.2 hands (LHC)","£5,500 offers"
"Top class 148 Show pony","Riding PonyBayMare6 years148 cm (AHC)","POA"
"Top Class M&M Lead Rein / First Ridden","Welsh Section AGreyMare3 years11.2 hands","£3,250"
"Wishworthy Jack Norey","Welsh Section BGelding9 years128 cm","£8,000"
"Potential Competition Pony","ConnemaraDunMare4 years14.2 hands","SOLD!"
"Perlino Broodmare","Welsh Section ACremelloMare15 years11 hands","£700"